{
 "format": "splashed-ink-session/v1",
 "id": "si-muuh1dr20ho0",
 "app": {
  "name": "splashed-ink",
  "version": "0.4.0"
 },
 "startedAt": "2026-10-04T23:48:03.422Z",
 "endedAt": "2026-10-04T23:48:20.230Z",
 "tickRate": 60,
 "stepsPerTick": 6,
 "seed": 493204800,
 "paperSeed": 179703349,
 "device": {
  "viewport": [
   200,
   300
  ],
  "dpr": 1,
  "sim": [
   125,
   188
  ],
  "touch": false,
  "tiltSensor": false,
  "lockedSettings": false
 },
 "settings": {
  "undo": "none",
  "drying": "normal",
  "ink": "normal",
  "words": "off",
  "sees": "paper",
  "redo": "final"
 },
 "endTick": 564,
 "summary": {
  "seconds": 9.4,
  "strokes": 5,
  "pourSeconds": 2.317,
  "pathLength": 1.279,
  "firstStrokeAfterSeconds": 0,
  "medianPauseSeconds": 0.5,
  "longestPauseSeconds": 0.833,
  "brushStrokes": 1,
  "undos": 1,
  "partnerTurns": 2,
  "partnerRedos": 1,
  "partnerErrors": 0,
  "partnerGestureSeconds": 2.8,
  "wordsSent": 1,
  "newSheets": 1,
  "settingChanges": 3
 },
 "events":[
  {"t":0,"e":"k","k":"undo","v":"unlimited"},
  {"t":0,"e":"pd","i":"u1","x":0.3,"y":0.3,"p":0.6},
  {"t":2,"e":"pm","i":"u1","x":0.32,"y":0.3164,"p":0.6},
  {"t":4,"e":"pm","i":"u1","x":0.34,"y":0.3309,"p":0.6},
  {"t":6,"e":"pm","i":"u1","x":0.36,"y":0.3421,"p":0.6},
  {"t":8,"e":"pm","i":"u1","x":0.38,"y":0.3486,"p":0.6},
  {"t":10,"e":"pm","i":"u1","x":0.4,"y":0.3498,"p":0.6},
  {"t":12,"e":"pm","i":"u1","x":0.42,"y":0.3455,"p":0.6},
  {"t":14,"e":"pm","i":"u1","x":0.44,"y":0.3362,"p":0.6},
  {"t":16,"e":"pm","i":"u1","x":0.46,"y":0.3229,"p":0.6},
  {"t":18,"e":"pm","i":"u1","x":0.48,"y":0.3071,"p":0.6},
  {"t":20,"e":"pm","i":"u1","x":0.5,"y":0.2905,"p":0.6},
  {"t":22,"e":"pm","i":"u1","x":0.52,"y":0.2749,"p":0.6},
  {"t":24,"e":"pm","i":"u1","x":0.54,"y":0.2622,"p":0.6},
  {"t":26,"e":"pm","i":"u1","x":0.56,"y":0.2535,"p":0.6},
  {"t":28,"e":"pm","i":"u1","x":0.58,"y":0.2501,"p":0.6},
  {"t":30,"e":"pm","i":"u1","x":0.6,"y":0.2521,"p":0.6},
  {"t":32,"e":"pm","i":"u1","x":0.62,"y":0.2593,"p":0.6},
  {"t":34,"e":"pm","i":"u1","x":0.64,"y":0.2711,"p":0.6},
  {"t":36,"e":"pm","i":"u1","x":0.66,"y":0.286,"p":0.6},
  {"t":38,"e":"pm","i":"u1","x":0.68,"y":0.3025,"p":0.6},
  {"t":40,"e":"pm","i":"u1","x":0.7,"y":0.3187,"p":0.6},
  {"t":40,"e":"pu","i":"u1"},
  {"t":70,"e":"pd","i":"u2","x":0.5,"y":0.6,"p":0.5},
  {"t":72,"e":"pm","i":"u2","x":0.5,"y":0.61,"p":0.5},
  {"t":74,"e":"pm","i":"u2","x":0.5,"y":0.62,"p":0.5},
  {"t":76,"e":"pm","i":"u2","x":0.5,"y":0.63,"p":0.5},
  {"t":78,"e":"pm","i":"u2","x":0.5,"y":0.64,"p":0.5},
  {"t":80,"e":"pm","i":"u2","x":0.5,"y":0.65,"p":0.5},
  {"t":82,"e":"pm","i":"u2","x":0.5,"y":0.66,"p":0.5},
  {"t":84,"e":"pm","i":"u2","x":0.5,"y":0.67,"p":0.5},
  {"t":86,"e":"pm","i":"u2","x":0.5,"y":0.68,"p":0.5},
  {"t":88,"e":"pm","i":"u2","x":0.5,"y":0.69,"p":0.5},
  {"t":90,"e":"pm","i":"u2","x":0.5,"y":0.7,"p":0.5},
  {"t":92,"e":"pm","i":"u2","x":0.5,"y":0.71,"p":0.5},
  {"t":94,"e":"pm","i":"u2","x":0.5,"y":0.72,"p":0.5},
  {"t":96,"e":"pm","i":"u2","x":0.5,"y":0.73,"p":0.5},
  {"t":98,"e":"pm","i":"u2","x":0.5,"y":0.74,"p":0.5},
  {"t":100,"e":"pm","i":"u2","x":0.5,"y":0.75,"p":0.5},
  {"t":100,"e":"pu","i":"u2"},
  {"t":100,"e":"un"},
  {"t":120,"e":"tl","v":"brush"},
  {"t":120,"e":"pd","i":"b1","x":0.2,"y":0.8,"p":0.5},
  {"t":121,"e":"pm","i":"b1","x":0.22,"y":0.7901,"p":0.5},
  {"t":122,"e":"pm","i":"b1","x":0.24,"y":0.7805,"p":0.5},
  {"t":123,"e":"pm","i":"b1","x":0.26,"y":0.7718,"p":0.5},
  {"t":124,"e":"pm","i":"b1","x":0.28,"y":0.7641,"p":0.5},
  {"t":125,"e":"pm","i":"b1","x":0.3,"y":0.7579,"p":0.5},
  {"t":126,"e":"pm","i":"b1","x":0.32,"y":0.7534,"p":0.5},
  {"t":127,"e":"pm","i":"b1","x":0.34,"y":0.7507,"p":0.5},
  {"t":128,"e":"pm","i":"b1","x":0.36,"y":0.75,"p":0.5},
  {"t":129,"e":"pm","i":"b1","x":0.38,"y":0.7513,"p":0.5},
  {"t":130,"e":"pm","i":"b1","x":0.4,"y":0.7545,"p":0.5},
  {"t":131,"e":"pm","i":"b1","x":0.42,"y":0.7596,"p":0.5},
  {"t":132,"e":"pm","i":"b1","x":0.44,"y":0.7662,"p":0.5},
  {"t":133,"e":"pm","i":"b1","x":0.46,"y":0.7742,"p":0.5},
  {"t":134,"e":"pm","i":"b1","x":0.48,"y":0.7833,"p":0.5},
  {"t":135,"e":"pm","i":"b1","x":0.5,"y":0.7929,"p":0.5},
  {"t":136,"e":"pm","i":"b1","x":0.52,"y":0.8029,"p":0.5},
  {"t":137,"e":"pm","i":"b1","x":0.54,"y":0.8128,"p":0.5},
  {"t":138,"e":"pm","i":"b1","x":0.56,"y":0.8221,"p":0.5},
  {"t":139,"e":"pm","i":"b1","x":0.58,"y":0.8306,"p":0.5},
  {"t":140,"e":"pm","i":"b1","x":0.6,"y":0.8378,"p":0.5},
  {"t":141,"e":"pm","i":"b1","x":0.62,"y":0.8436,"p":0.5},
  {"t":142,"e":"pm","i":"b1","x":0.64,"y":0.8476,"p":0.5},
  {"t":143,"e":"pm","i":"b1","x":0.66,"y":0.8497,"p":0.5},
  {"t":144,"e":"pm","i":"b1","x":0.68,"y":0.8498,"p":0.5},
  {"t":145,"e":"pm","i":"b1","x":0.7,"y":0.8479,"p":0.5},
  {"t":145,"e":"pu","i":"b1"},
  {"t":155,"e":"tl","v":"pour"},
  {"t":155,"e":"g","x":0.1,"y":0.7},
  {"t":195,"e":"g","x":0,"y":0},
  {"t":195,"e":"k","k":"ink","v":"unlimited"},
  {"t":195,"e":"pot","c":0.45},
  {"t":195,"e":"pd","i":"u3","x":0.7,"y":0.5,"p":0.5},
  {"t":197,"e":"pm","i":"u3","x":0.68,"y":0.51,"p":0.5},
  {"t":199,"e":"pm","i":"u3","x":0.66,"y":0.52,"p":0.5},
  {"t":201,"e":"pm","i":"u3","x":0.64,"y":0.53,"p":0.5},
  {"t":203,"e":"pm","i":"u3","x":0.62,"y":0.54,"p":0.5},
  {"t":205,"e":"pm","i":"u3","x":0.6,"y":0.55,"p":0.5},
  {"t":207,"e":"pm","i":"u3","x":0.58,"y":0.56,"p":0.5},
  {"t":209,"e":"pm","i":"u3","x":0.56,"y":0.57,"p":0.5},
  {"t":211,"e":"pm","i":"u3","x":0.54,"y":0.58,"p":0.5},
  {"t":213,"e":"pm","i":"u3","x":0.52,"y":0.59,"p":0.5},
  {"t":215,"e":"pm","i":"u3","x":0.5,"y":0.6,"p":0.5},
  {"t":217,"e":"pm","i":"u3","x":0.48,"y":0.61,"p":0.5},
  {"t":219,"e":"pm","i":"u3","x":0.46,"y":0.62,"p":0.5},
  {"t":219,"e":"pu","i":"u3"},
  {"t":219,"e":"k","k":"drying","v":"fast"},
  {"t":244,"e":"sh","s":12345},
  {"t":249,"e":"pd","i":"u4","x":0.4,"y":0.4,"p":0.5},
  {"t":251,"e":"pm","i":"u4","x":0.4,"y":0.42,"p":0.5},
  {"t":253,"e":"pm","i":"u4","x":0.4,"y":0.44,"p":0.5},
  {"t":255,"e":"pm","i":"u4","x":0.4,"y":0.46,"p":0.5},
  {"t":257,"e":"pm","i":"u4","x":0.4,"y":0.48,"p":0.5},
  {"t":259,"e":"pm","i":"u4","x":0.4,"y":0.5,"p":0.5},
  {"t":261,"e":"pm","i":"u4","x":0.4,"y":0.52,"p":0.5},
  {"t":263,"e":"pm","i":"u4","x":0.4,"y":0.54,"p":0.5},
  {"t":265,"e":"pm","i":"u4","x":0.4,"y":0.56,"p":0.5},
  {"t":267,"e":"pm","i":"u4","x":0.4,"y":0.58,"p":0.5},
  {"t":269,"e":"pm","i":"u4","x":0.4,"y":0.6,"p":0.5},
  {"t":269,"e":"pu","i":"u4"},
  {"t":279,"e":"pa","partner":"test","words":"a few words","sees":"paper"},
  {"t":279,"e":"pg","gestures":[{"type":"pour","x":0.6,"y":0.3,"seconds":0.5,"path":[[0.7,0.35]],"ink":0.8},{"type":"stroke","path":[[0.2,0.2],[0.5,0.3],[0.8,0.2]],"seconds":0.8},{"type":"tilt","dx":0.3,"dy":1,"seconds":0.5},{"type":"wait","seconds":0.5}]},
  {"t":488,"e":"rd"},
  {"t":488,"e":"pa","partner":"test","sees":"paper"},
  {"t":488,"e":"pg","gestures":[{"type":"pour","x":0.3,"y":0.7,"seconds":0.5,"path":[]}]}
 ]
}